[
  {
    "noise_response_id": "noise_level1_gunshot_flicker_v0",
    "level_id": "level1_service_halls",
    "source_type": "Gunshot",
    "responses": [
      {
        "response_type": "None",
        "weight": 50,
        "entity_id": null,
        "description": "The shot echoes, then fades."
      },
      {
        "response_type": "DistantCreature",
        "weight": 20,
        "entity_id": "entity_flicker_stalker",
        "description": "Distant scuffing answers from a service hall."
      },
      {
        "response_type": "Scream",
        "weight": 12,
        "entity_id": "entity_flicker_stalker",
        "description": "A harsh scream cuts through the lights."
      },
      {
        "response_type": "Banging",
        "weight": 10,
        "entity_id": "entity_flicker_stalker",
        "description": "Something bangs against metal somewhere nearby."
      },
      {
        "response_type": "EntityApproach",
        "weight": 8,
        "entity_id": "entity_flicker_stalker",
        "description": "The Flicker Stalker is drawn toward the noise."
      }
    ],
    "description": "Level 1 gunshot response table. Gunfights are risky, but not every shot summons an entity."
  }
]
